<!ELEMENT employee (empId, name, department, position, salary, email, phone, address, joinDate, status)>
<!ELEMENT empId (#PCDATA)>
<!ELEMENT name (firstName, lastName)>
<!ELEMENT firstName (#PCDATA)>
<!ELEMENT lastName (#PCDATA)>
<!ELEMENT department (#PCDATA)>
<!ELEMENT position (#PCDATA)>
<!ELEMENT salary (#PCDATA)>
<!ELEMENT email (#PCDATA)>
<!ELEMENT phone (#PCDATA)>
<!ELEMENT address (street, city, state, country)>
<!ELEMENT street (#PCDATA)>
<!ELEMENT city (#PCDATA)>
<!ELEMENT state (#PCDATA)>
<!ELEMENT country (#PCDATA)>
<!ELEMENT joinDate (#PCDATA)>
<!ELEMENT status (#PCDATA)>
